S.no,Tagging,Question,Reply
1,About Institute,What is Bignalytics?,"Bignalytics is a prominent training institute located in Indore, Madhya Pradesh, specializing in high-demand fields of the 21st century. We offer comprehensive courses in Data Science, Machine Learning, Artificial Intelligence, and Data Analytics, designed to equip students with the skills and knowledge necessary to excel in these rapidly evolving industries. Our focus is on providing practical, industry-relevant training that bridges the gap between academic learning and real-world application."
2,About Institute,Does Bignalytics have any partnerships with universities?,"Bignalytics collaborates with select universities to offer joint programs and academic credits, enhancing the educational value and providing students with more opportunities. Please contact the institute for specific university partnerships."
3,Admission Process,Can I switch from one course to another after enrollment?,"Yes, but you may need to pay the difference in fees and seek approval from the administration."
4,Admission Process,Can I enroll in multiple courses at the same time?,"Yes, but it is recommended to focus on one course at a time for better learning outcomes."
5,Certification,Will I receive a certificate after completing the course?,"Yes, a certification of completion is provided."
6,Certification,Is the certification industry-recognized?,"Yes, it is recognized by various companies in the data analytics and AI industry."
7,Certification,Are there exams or assessments?,"Yes, students undergo assessments, projects, and mock tests."
8,Certification,Can I use the certification to get a job abroad?,"While helpful, additional global certifications may be required."
9,Certification,Does Bignalytics offer international certification exams?,"No, but the courses prepare students for industry-recognized exams."
10,Certification,Does Bignalytics provide course completion certificates?,"Yes, every student who completes a course successfully receives a certification."
11,Certification,Are the certifications recognized in the industry?,"Yes, certifications from Bignalytics are recognized by various companies in the data science and analytics industry."
12,Certification,Do I need to pass an exam to get certified?,"Yes, students need to complete assignments, projects, and assessments to receive certification."
13,Certification,Do you provide a printed course certificate?,"Certificates are provided digitally, but printed versions can be requested."
14,Class Schedule,What are the class timings?,"Bignalytics is committed to providing flexible learning schedules to accommodate the diverse needs of our students. Classes are held from Monday to Saturday, between 11 AM and 8 PM. This extended schedule allows students to choose timings that suit their personal and professional commitments, ensuring a convenient and accessible learning experience."
15,Class Schedule,How often are classes conducted?,"To ensure a balanced and effective learning experience, Bignalytics conducts courses three days a week. In addition to classroom sessions, we also emphasize practical application through lab sessions, which are held on the remaining days. This combination of theoretical instruction and hands-on practice allows students to reinforce their learning, develop practical skills, and gain real-world experience."
16,Class Schedule,Are weekend classes available?,Please note that Bignalytics focuses its instructional schedule from Monday to Saturday. The institute is closed on Sundays to allow for facility maintenance and to provide a day of rest for both students and staff.
17,Class Schedule,What is the average duration of each lecture?,Each lecture typically lasts between 1 to 2 hours.
18,Contact Info,How can I contact Bignalytics?,"You can easily get in touch with Bignalytics through multiple channels. For direct communication, you can call us at 093992-00960. Alternatively, you can send us an email at contact@bignalytics.in for any queries or detailed information you may need. We strive to be responsive and provide timely assistance to all inquiries."
19,Course Details,What is covered in the Advanced Data Analytics course?,"The Advanced Data Analytics course at Bignalytics is designed to provide a comprehensive understanding of the data analytics process and equip students with the tools and techniques necessary to excel in this field. The curriculum covers Python for data analysis, SQL for database management, Power BI for data visualization, Excel for data manipulation, ETL processes for data integration, statistics for data interpretation, business intelligence for strategic decision-making, and reporting for effective communication of insights. This comprehensive coverage ensures that students develop a holistic skill set that is highly valued in the industry."
20,Course Details,What skills will I learn in the Data Science & Analytics course?,"The Data Science & Analytics course at Bignalytics is meticulously structured to provide you with a robust skill set that is highly valued in the data science industry. You will gain proficiency in essential programming languages like Python and R, which are the workhorses of data analysis and statistical computing. You'll also master SQL for effective database management and data retrieval. Furthermore, the course delves into the core concepts of machine learning and deep learning, enabling you to build predictive models and extract meaningful insights from complex datasets. We also cover big data technologies to handle large-scale data processing and business intelligence tools to visualize and communicate data-driven findings effectively."
21,Course Details,Do I get hands-on experience?,"Absolutely! At Bignalytics, we strongly believe in the importance of experiential learning. Our courses are designed to provide extensive hands-on experience through a variety of practical methods. You will be actively involved in numerous projects that simulate real-world scenarios, allowing you to apply the concepts you learn in a practical context. We also have dedicated lab sessions where you can experiment, practice, and refine your skills. Moreover, you will work with real-world datasets, giving you valuable experience in tackling the challenges and complexities of actual data. This practical approach ensures that you not only understand the theory but also develop the practical skills necessary to succeed in a data-driven role."
22,Course Details,What programming languages are covered?,"Python, R, and SQL are the main languages taught."
23,Course Details,Do courses include Power BI or Tableau?,"Yes, Power BI is included, and Tableau is covered in some courses."
24,Course Details,What machine learning frameworks are used?,"Scikit-learn, TensorFlow, and PyTorch are used for AI & ML courses."
25,Course Details,Will I work on real datasets?,"Yes, students get hands-on experience with real-world datasets."
26,Course Details,Do you provide soft skills training?,"Yes, communication and interview skills are covered."
27,Course Details,How long does it take to complete a course?,"Course durations vary from 6 to 14 months, depending on the program."
28,Course Details,Does Bignalytics provide soft skills training?,"Yes, soft skills such as communication, teamwork, and problem-solving are included."
29,Course Details,Will I learn how to deploy AI models?,"Yes, courses cover AI model deployment using Flask, Docker, and AWS."
30,Course Details,What software tools are covered in the courses?,"Python, R, SQL, Power BI, Tableau, TensorFlow, and Hadoop, among others."
31,Course Details,Are practice projects included in the curriculum?,"Yes, each course includes hands-on projects to help students gain real-world experience."
32,Course Details,Do students work on live industry projects?,"Yes, some advanced courses include real-time industry-based projects."
33,Course Details,Are live coding sessions part of the training?,"Yes, students get hands-on experience through live coding sessions."
34,Course Details,Will I learn about cloud platforms?,"Yes, courses cover AWS, Azure, and Google Cloud for cloud-based analytics."
35,Course Details,Are case studies included in the training?,"Yes, students analyze real-world case studies as part of the learning process."
36,Course Details,Will I learn about MLOps and model deployment?,"Yes, advanced courses cover MLOps, model deployment, and CI/CD pipelines."
37,Course Details,How does Bignalytics incorporate the latest industry trends into its curriculum?,"Bignalytics continuously updates its curriculum to reflect the latest industry trends, tools, and technologies through regular reviews, feedback from industry experts, and incorporating emerging topics like Generative AI and cloud computing."
38,Course Details,How does Bignalytics address ethical considerations in AI and data science?,"Bignalytics integrates ethical considerations into its AI and data science curriculum, covering topics like data privacy, algorithmic bias, and responsible AI development to ensure students are aware of and practice ethical principles."
39,Course Details,What is Bignalytics's approach to teaching programming concepts to beginners?,"Bignalytics uses a beginner-friendly approach to teaching programming concepts, starting with the fundamentals, using visual aids, providing hands-on exercises, and offering personalized support to ensure students grasp the basics effectively."
40,Course Details,How does Bignalytics ensure that students stay updated with the latest software and tools?,"Bignalytics ensures that students stay updated with the latest software and tools by incorporating them into the curriculum, providing access to software licenses, and conducting workshops on new technologies."
41,Course Details,What kind of projects do students typically work on in the data science courses?,"Students work on a variety of projects in the data science courses, including real-world case studies, data analysis projects, machine learning model building, and data visualization dashboards, covering diverse domains like healthcare, finance, and marketing."
42,Course Details,How does Bignalytics help students develop their communication and presentation skills?,"Bignalytics helps students develop their communication and presentation skills through presentations, group discussions, and project demonstrations, providing feedback on their communication style and presentation techniques."
43,Course Details,How does Bignalytics help students understand the business context of data analysis?,"Bignalytics emphasizes the business context of data analysis by incorporating case studies, real-world scenarios, and business intelligence tools into the curriculum, helping students understand how data insights drive business decisions."
44,Course Details,How does Bignalytics help students develop their data cleaning and preprocessing skills?,"Bignalytics emphasizes data cleaning and preprocessing skills through hands-on exercises, real-world datasets, and practical assignments that require students to handle missing values, outliers, and data inconsistencies."
45,Course Details,How does Bignalytics help students understand the legal and regulatory aspects of data science?,"Bignalytics integrates legal and regulatory aspects into its curriculum, covering topics like data privacy laws (e.g., GDPR), data security regulations, and ethical considerations in data handling."
46,Course Details,How does Bignalytics help students develop their skills in data integration and ETL processes?,"Bignalytics provides hands-on training in data integration and ETL processes, covering tools and techniques for extracting, transforming, and loading data from various sources into a unified format."
47,Course Fees,What are the fees for different courses?,"Bignalytics strives to provide high-quality education at a competitive price point. Our fees for different courses typically range from â‚¹33,000 to â‚¹55,500. The exact fee structure may vary depending on the specific course you choose and any applicable discounts or promotions. We recommend contacting our admissions office for the most accurate and up-to-date information on course fees and payment options."
48,Course Fees,Are there any discounts available?,"Yes, Bignalytics believes in making quality education accessible. We offer various discount options, with potential discounts of up to 25% available to eligible students. Additionally, we provide further benefits and incentives for students who opt for lump sum payments. These discounts can significantly reduce the overall cost of your education, making it more affordable to pursue your career goals with Bignalytics."
49,Course Fees,Can I pay in installments?,"Yes, Bignalytics understands that managing educational expenses can be a concern for many students. To provide financial flexibility, we offer EMI (Equated Monthly Installment) options for all our courses. This allows students to pay their fees in convenient monthly installments, making it easier to budget and finance their education without undue financial burden."
50,Course Fees,Is there any scholarship program?,"While Bignalytics currently focuses on providing accessible education through various discount options, there is no official scholarship program explicitly mentioned. However, we are committed to helping students manage the cost of their education through discounts up to 25% and additional benefits for lump sum payments. We encourage students to inquire about available discounts and payment plans to make their education more affordable."
51,Course Fees,What is the refund policy?,"Bignalytics aims to ensure transparency in all its policies. However, specific details regarding the refund policy are not explicitly outlined in the provided information. It is advisable to contact the institute directly for comprehensive information on their refund procedures, eligibility criteria, and any associated terms and conditions. This will help you make an informed decision regarding your enrollment."
52,Courses Offered,What courses are offered at Bignalytics?,"Bignalytics offers a diverse range of courses designed to cater to the growing demand for skilled professionals in cutting-edge technologies. Our course offerings include Data Science, Machine Learning, Artificial Intelligence, Data Analytics, Python Programming, Generative AI, and Power BI. Each course is structured to provide in-depth knowledge, hands-on experience, and industry-relevant skills, empowering students to build successful careers in their chosen fields."
53,Courses Offered,Is there a specialization in AI & Machine Learning?,"Yes, Bignalytics offers a specialized AI & Machine Learning course designed to provide in-depth knowledge and skills in this cutting-edge field. This comprehensive program covers a wide range of advanced topics, including deep learning, Natural Language Processing (NLP), computer vision, reinforcement learning, and AI ethics. Students will gain a deep understanding of the theoretical concepts and practical applications of AI and machine learning, preparing them for specialized roles in this rapidly growing domain."
54,Courses Offered,Are there any industry-specific data science courses?,"Yes, Bignalytics provides specialized data science courses tailored to specific industries such as healthcare, finance, and e-commerce, addressing the unique challenges and data requirements of each sector."
55,Courses Offered,Does Bignalytics offer any short-term certificate programs or workshops?,"Yes, in addition to long-term courses, Bignalytics conducts short-term certificate programs and workshops on specific topics like Python for beginners, data visualization with Tableau, and machine learning fundamentals."
56,Courses Offered,Are there any specific courses on data visualization techniques?,"Yes, Bignalytics offers dedicated courses on data visualization techniques, covering tools like Tableau, Power BI, and Matplotlib, and teaching students how to create effective and insightful visualizations."
57,Courses Offered,Does Bignalytics offer any courses on cloud computing for data science?,"Yes, Bignalytics provides courses on cloud computing platforms like AWS, Azure, and Google Cloud, teaching students how to leverage cloud services for data storage, processing, and analysis."
58,Courses Offered,Does Bignalytics provide any training on data engineering concepts and tools?,"Yes, Bignalytics includes data engineering concepts and tools in its curriculum, covering topics like ETL processes, data warehousing, and big data technologies to provide students with a comprehensive understanding of the data pipeline."
59,Courses Offered,Are there any specific courses on Natural Language Processing (NLP)?,"Yes, Bignalytics offers specialized courses on Natural Language Processing (NLP), covering topics like text mining, sentiment analysis, and natural language understanding, to equip students with skills in this growing field."
60,Courses Offered,Does Bignalytics offer any training on time series analysis?,"Yes, Bignalytics provides training on time series analysis, covering techniques for analyzing and forecasting time-dependent data, which is crucial in various industries like finance and economics."
61,Courses Offered,Are there any specific courses on computer vision?,"Yes, Bignalytics offers specialized courses on computer vision, covering topics like image processing, object detection, and image classification, to prepare students for careers in this exciting area of AI."
62,Courses Offered,Does Bignalytics provide any training on big data technologies like Hadoop and Spark?,"Yes, Bignalytics includes training on big data technologies like Hadoop and Spark in its curriculum, teaching students how to process and analyze large datasets using these powerful tools."
63,Courses Offered,Are there any specific courses on reinforcement learning?,"Yes, Bignalytics offers specialized courses on reinforcement learning, covering algorithms and techniques for training agents to make decisions in complex environments, which is used in robotics, gaming, and other applications."
64,Courses Offered,Does Bignalytics provide any training on data security and privacy?,"Yes, Bignalytics includes training on data security and privacy in its curriculum, covering topics like data encryption, access control, and data privacy regulations, to ensure students are aware of and practice data protection principles."
65,Courses Offered,Are there any specific courses on deep learning frameworks like TensorFlow and PyTorch?,"Yes, Bignalytics offers specialized courses on deep learning frameworks like TensorFlow and PyTorch, providing hands-on training in building and deploying deep learning models."
66,Courses Offered,Does Bignalytics provide any training on AIOps (AI for IT Operations)?,"Yes, Bignalytics includes training on AIOps concepts and tools, covering how AI can be used to automate and improve IT operations, such as monitoring, incident management, and performance optimization."
67,Courses Offered,Are there any specific courses on generative AI models?,"Yes, Bignalytics offers specialized courses on generative AI models, covering techniques for creating new data instances, such as images, text, and music, using models like GANs and VAEs."
68,Courses Offered,Does Bignalytics provide any training on data governance and data management?,"Yes, Bignalytics includes training on data governance and data management, covering topics like data quality, data standards, and data governance frameworks, to ensure students understand how to manage and govern data effectively."
69,Courses Offered,Are there any specific courses on ethical hacking or cybersecurity for data science?,"Bignalytics integrates ethical hacking and cybersecurity concepts into its data science curriculum, covering topics like data security best practices, vulnerability assessment, and ethical considerations in cybersecurity."
70,Courses Offered,Does Bignalytics provide any training on IoT (Internet of Things) data analytics?,"Yes, Bignalytics includes training on IoT data analytics, covering how to collect, process, and analyze data from IoT devices, which is becoming increasingly important in various industries."
71,Courses Offered,Are there any specific courses on predictive analytics?,"Yes, Bignalytics offers specialized courses on predictive analytics, covering techniques for building models to predict future outcomes, which is widely used in business, finance, and other fields."
72,Courses Offered,Does Bignalytics provide any training on blockchain technology for data applications?,"While not a core focus, Bignalytics introduces blockchain concepts in relation to data applications, covering topics like data integrity, security, and decentralized data management."
73,Courses Offered,Are there any specific courses on recommendation systems?,"Yes, Bignalytics offers specialized courses on recommendation systems, covering algorithms and techniques for building personalized recommendation engines, which are used in e-commerce, entertainment, and other industries."
74,Courses Offered,Does Bignalytics offer any specific training on anomaly detection techniques?,"Yes, Bignalytics provides specialized training on anomaly detection techniques, covering algorithms and methods for identifying outliers and unusual patterns in data, which is crucial for fraud detection, cybersecurity, and predictive maintenance."
75,Courses Offered,Are there any specific courses on Bayesian statistics?,"Yes, Bignalytics offers training that includes Bayesian statistics, covering its principles, methods, and applications in data analysis and machine learning."
76,Courses Offered,Does Bignalytics provide any training on data storytelling?,"Yes, Bignalytics provides training on data storytelling, teaching students how to communicate data insights effectively through narratives, visualizations, and presentations, which is essential for influencing stakeholders."
77,Courses Offered,Are there any specific courses on graph databases and network analysis?,"Yes, Bignalytics offers training that includes graph databases and network analysis, covering how to model, analyze, and visualize relationships and connections in data."
78,Courses Offered,Does Bignalytics provide any training on survival analysis?,"Yes, Bignalytics provides training on survival analysis, covering techniques for analyzing time-to-event data, which is used in healthcare, finance, and other fields."
79,Courses Offered,Are there any specific courses on geospatial data analysis?,"Yes, Bignalytics offers training that includes geospatial data analysis, covering how to work with location-based data, GIS tools, and spatial analysis techniques."
80,Courses Offered,Does Bignalytics provide any training on A/B testing?,"Yes, Bignalytics provides training on A/B testing, covering how to design, conduct, and analyze A/B tests to optimize products, websites, and marketing campaigns."
81,Courses Offered,Are there any specific courses on time series forecasting?,"Yes, Bignalytics offers dedicated training on time series forecasting, covering advanced techniques and models for accurate predictions."
82,Courses Offered,Does Bignalytics provide any training on agent-based modeling?,"Yes, Bignalytics provides training that includes agent-based modeling, covering how to simulate complex systems by modeling the interactions of individual agents."
83,Courses Offered,Are there any specific courses on recommender systems?,"Yes, Bignalytics offers specialized training on recommender systems, covering advanced algorithms and techniques for building personalized recommendation engines."
84,Courses Offered,Does Bignalytics provide any training on Bayesian networks?,"Yes, Bignalytics provides training that includes Bayesian networks, covering how to model probabilistic relationships and make inferences from data."
85,Courses Offered,Are there any specific courses on survival analysis?,"Yes, Bignalytics offers specialized training on survival analysis, covering techniques for analyzing time-to-event data and making predictions."
86,Courses Offered,Does Bignalytics provide any training on stochastic processes?,"Yes, Bignalytics provides training that includes stochastic processes, covering mathematical models for random phenomena and their applications."
87,Courses Offered,Are there any specific courses on deep reinforcement learning?,"Yes, Bignalytics offers specialized training on deep reinforcement learning, covering advanced algorithms and techniques for combining deep learning with reinforcement learning."
88,Courses Offered,Does Bignalytics provide any training on Monte Carlo methods?,"Yes, Bignalytics provides training that includes Monte Carlo methods, covering computational techniques for simulating random processes and solving complex problems."
89,Courses Offered,Are there any specific courses on causal inference?,"Yes, Bignalytics offers specialized training on causal inference, covering methods for determining cause-and-effect relationships from data."
90,Courses Offered,Does Bignalytics provide any training on Gaussian processes?,"Yes, Bignalytics provides training that includes Gaussian processes, covering probabilistic models for regression and classification."
91,Courses Offered,Are there any specific courses on anomaly detection in time series data?,"Yes, Bignalytics offers specialized training on anomaly detection in time series data, covering advanced algorithms and techniques for identifying unusual patterns and outliers in time-dependent data."
